{
  "$schema": "https://json-schema.org/draft/2020-12/schema",
  "$id": "https://passclip.example/schema/passclip-import.v1.schema.json",
  "title": "Passclip Import",
  "description": "Structured data that Passclip turns into Apple Wallet passes. Usually produced by an AI model using prompts/extract-to-passclip.txt, or written by hand. Version 1.1; version 1.0 documents are read too.",
  "type": "object",
  "additionalProperties": false,
  "required": ["schemaVersion", "passes"],
  "properties": {
    "schemaVersion": {
      "description": "Format version: \"1.1\" (adds the ean13, code39, codabar and itf barcode types), or \"1.0\".",
      "enum": ["1.1", "1.0"]
    },
    "source": { "$ref": "#/$defs/source" },
    "passes": {
      "description": "One entry per ticket, person, travel segment, card or coupon. Empty when nothing usable was found (explain why in warnings).",
      "type": "array",
      "maxItems": 20,
      "items": { "$ref": "#/$defs/pass" }
    },
    "warnings": { "$ref": "#/$defs/warnings" }
  },
  "$defs": {
    "pass": {
      "type": "object",
      "additionalProperties": false,
      "required": ["type", "title"],
      "properties": {
        "type": {
          "description": "Apple Wallet pass style. eventTicket: concerts, sports, theater, movies, conferences, museums. boardingPass: flights, trains, buses, ferries. storeCard: loyalty or membership cards with points or a balance. coupon: discounts, offers, promo codes. generic: anything else, such as gym or library cards, parking or reservations.",
          "enum": ["eventTicket", "boardingPass", "storeCard", "coupon", "generic"]
        },
        "title": {
          "description": "Main name: the event, the route (e.g. \"Tokyo → Paris\"), the card or the offer.",
          "type": "string", "minLength": 1, "maxLength": 80
        },
        "subtitle": {
          "description": "Short second line, e.g. a tour name or \"Membership\".",
          "type": "string", "minLength": 1, "maxLength": 60
        },
        "organization": {
          "description": "Who issued it: the venue, airline, rail company or shop.",
          "type": "string", "minLength": 1, "maxLength": 60
        },
        "description": {
          "description": "Accessibility description read by VoiceOver. Passclip generates one if missing.",
          "type": "string", "minLength": 1, "maxLength": 120
        },
        "holderName": {
          "description": "Ticket holder, passenger or member name, as written.",
          "type": "string", "minLength": 1, "maxLength": 80
        },
        "confirmationCode": {
          "description": "Booking or order reference, as written.",
          "type": "string", "minLength": 1, "maxLength": 40
        },
        "ticketNumber": {
          "description": "Ticket number, as written.",
          "type": "string", "minLength": 1, "maxLength": 60
        },
        "start": {
          "description": "Event start, or departure time for travel.",
          "$ref": "#/$defs/dateTime"
        },
        "end": {
          "description": "Event end, or arrival time for travel.",
          "$ref": "#/$defs/dateTime"
        },
        "timeZone": {
          "description": "IANA time zone where the event or departure happens, e.g. Asia/Tokyo. Used when a time has no UTC offset, and for calendar events.",
          "type": "string",
          "pattern": "^[A-Za-z_]+(/[A-Za-z0-9_+-]+)*$",
          "maxLength": 64
        },
        "expires": {
          "description": "When the pass stops being valid (coupons, memberships). A date-only value means the end of that day.",
          "$ref": "#/$defs/dateOrDateTime"
        },
        "venue": { "$ref": "#/$defs/place" },
        "seat": { "$ref": "#/$defs/seat" },
        "transit": { "$ref": "#/$defs/transit" },
        "membership": { "$ref": "#/$defs/membership" },
        "offer": { "$ref": "#/$defs/offer" },
        "price": { "$ref": "#/$defs/money" },
        "barcode": { "$ref": "#/$defs/barcode" },
        "notes": {
          "description": "Useful information such as door times, bag rules or check-in instructions.",
          "type": "string", "minLength": 1, "maxLength": 2000
        },
        "extraFields": {
          "description": "Other useful details as label/value pairs. The first ones may appear on the front of the pass; the rest go on the back.",
          "type": "array",
          "maxItems": 10,
          "items": { "$ref": "#/$defs/field" }
        },
        "attachments": {
          "description": "Files and links clipped to the pass. They appear as links on the back of the pass.",
          "type": "array",
          "maxItems": 10,
          "items": { "$ref": "#/$defs/attachment" }
        },
        "style": { "$ref": "#/$defs/style" },
        "calendar": { "$ref": "#/$defs/calendar" },
        "warnings": { "$ref": "#/$defs/warnings" }
      },
      "allOf": [
        {
          "if": {
            "type": "object",
            "required": ["type"],
            "properties": { "type": { "const": "boardingPass" } }
          },
          "then": {
            "type": "object",
            "properties": { "transit": true },
            "required": ["transit"]
          }
        }
      ]
    },

    "place": {
      "description": "Where an event happens.",
      "type": "object",
      "additionalProperties": false,
      "required": ["name"],
      "properties": {
        "name": { "type": "string", "minLength": 1, "maxLength": 100 },
        "address": { "type": "string", "minLength": 1, "maxLength": 200 },
        "city": { "type": "string", "minLength": 1, "maxLength": 80 },
        "country": { "type": "string", "minLength": 1, "maxLength": 80 },
        "room": {
          "description": "Hall, room, screen or stage inside the venue.",
          "type": "string", "minLength": 1, "maxLength": 60
        },
        "latitude": { "$ref": "#/$defs/latitude" },
        "longitude": { "$ref": "#/$defs/longitude" }
      },
      "dependentRequired": {
        "latitude": ["longitude"],
        "longitude": ["latitude"]
      }
    },

    "stop": {
      "description": "A departure or arrival point. Needs at least a code, name or city.",
      "type": "object",
      "additionalProperties": false,
      "properties": {
        "code": {
          "description": "Airport or station code as printed, e.g. HND.",
          "type": "string", "minLength": 1, "maxLength": 10
        },
        "name": {
          "description": "Airport or station name.",
          "type": "string", "minLength": 1, "maxLength": 100
        },
        "city": { "type": "string", "minLength": 1, "maxLength": 80 },
        "terminal": { "type": "string", "minLength": 1, "maxLength": 20 },
        "latitude": { "$ref": "#/$defs/latitude" },
        "longitude": { "$ref": "#/$defs/longitude" }
      },
      "anyOf": [
        { "type": "object", "properties": { "code": true }, "required": ["code"] },
        { "type": "object", "properties": { "name": true }, "required": ["name"] },
        { "type": "object", "properties": { "city": true }, "required": ["city"] }
      ],
      "dependentRequired": {
        "latitude": ["longitude"],
        "longitude": ["latitude"]
      }
    },

    "transit": {
      "description": "Travel details. Required for boarding passes.",
      "type": "object",
      "additionalProperties": false,
      "required": ["mode", "from", "to"],
      "properties": {
        "mode": { "enum": ["air", "train", "bus", "boat", "other"] },
        "carrier": {
          "description": "Airline or operator name.",
          "type": "string", "minLength": 1, "maxLength": 60
        },
        "carrierCode": {
          "description": "Airline code, e.g. NH.",
          "type": "string", "pattern": "^[A-Z0-9]{2,3}$"
        },
        "number": {
          "description": "Flight, train or route number as printed, e.g. \"NH 7\" or \"Express 503\".",
          "type": "string", "minLength": 1, "maxLength": 20
        },
        "from": { "$ref": "#/$defs/stop" },
        "to": { "$ref": "#/$defs/stop" },
        "boardingTime": { "$ref": "#/$defs/dateTime" },
        "gate": { "type": "string", "minLength": 1, "maxLength": 10 },
        "platform": { "type": "string", "minLength": 1, "maxLength": 10 },
        "boardingGroup": { "type": "string", "minLength": 1, "maxLength": 10 },
        "cabin": {
          "description": "Travel class, e.g. Economy.",
          "type": "string", "minLength": 1, "maxLength": 30
        },
        "car": {
          "description": "Train car or coach number.",
          "type": "string", "minLength": 1, "maxLength": 10
        }
      }
    },

    "seat": {
      "type": "object",
      "additionalProperties": false,
      "minProperties": 1,
      "properties": {
        "section": { "type": "string", "minLength": 1, "maxLength": 20 },
        "row": { "type": "string", "minLength": 1, "maxLength": 10 },
        "number": {
          "description": "Seat number, e.g. 12 or 34K.",
          "type": "string", "minLength": 1, "maxLength": 10
        },
        "entrance": {
          "description": "Gate, door or entrance at a venue.",
          "type": "string", "minLength": 1, "maxLength": 40
        },
        "description": {
          "description": "e.g. General admission or Standing.",
          "type": "string", "minLength": 1, "maxLength": 60
        }
      }
    },

    "membership": {
      "type": "object",
      "additionalProperties": false,
      "minProperties": 1,
      "properties": {
        "programName": { "type": "string", "minLength": 1, "maxLength": 60 },
        "memberId": { "type": "string", "minLength": 1, "maxLength": 60 },
        "tier": { "type": "string", "minLength": 1, "maxLength": 30 },
        "since": { "$ref": "#/$defs/dateOrDateTime" },
        "points": { "type": "number" },
        "balance": { "$ref": "#/$defs/money" }
      }
    },

    "offer": {
      "type": "object",
      "additionalProperties": false,
      "minProperties": 1,
      "properties": {
        "headline": {
          "description": "Short benefit, e.g. \"20% off\".",
          "type": "string", "minLength": 1, "maxLength": 40
        },
        "code": {
          "description": "Promo code to type or show at checkout.",
          "type": "string", "minLength": 1, "maxLength": 40
        },
        "terms": { "type": "string", "minLength": 1, "maxLength": 1000 }
      }
    },

    "money": {
      "type": "object",
      "additionalProperties": false,
      "required": ["amount", "currency"],
      "properties": {
        "amount": { "type": "number", "minimum": 0 },
        "currency": {
          "description": "ISO 4217 code, e.g. JPY, USD, EUR.",
          "type": "string", "pattern": "^[A-Z]{3}$"
        }
      }
    },

    "barcode": {
      "type": "object",
      "additionalProperties": false,
      "required": ["format", "message"],
      "properties": {
        "format": {
          "description": "The type of code. ean13, code39, codabar and itf show in Wallet on iOS 27 and later.",
          "enum": ["qr", "pdf417", "aztec", "code128", "ean13", "code39", "codabar", "itf"]
        },
        "message": {
          "description": "The exact data inside the code. Must come from the source text or a real scan, never invented.",
          "type": "string", "minLength": 1, "maxLength": 2000
        },
        "altText": {
          "description": "Short text shown under the code, often the ticket number.",
          "type": "string", "minLength": 1, "maxLength": 60
        }
      }
    },

    "field": {
      "type": "object",
      "additionalProperties": false,
      "required": ["label", "value"],
      "properties": {
        "label": { "type": "string", "minLength": 1, "maxLength": 30 },
        "value": { "type": "string", "minLength": 1, "maxLength": 300 }
      }
    },

    "attachment": {
      "type": "object",
      "additionalProperties": false,
      "required": ["title", "url"],
      "properties": {
        "title": { "type": "string", "minLength": 1, "maxLength": 60 },
        "url": {
          "description": "https links only.",
          "type": "string", "pattern": "^https://[^\\s]+$", "maxLength": 2000
        },
        "kind": { "enum": ["pdf", "image", "link", "map", "other"] }
      }
    },

    "style": {
      "description": "Pass colors. Optional; Passclip picks readable defaults per pass type.",
      "type": "object",
      "additionalProperties": false,
      "minProperties": 1,
      "properties": {
        "backgroundColor": { "$ref": "#/$defs/hexColor" },
        "foregroundColor": { "$ref": "#/$defs/hexColor" },
        "labelColor": { "$ref": "#/$defs/hexColor" }
      }
    },

    "calendar": {
      "description": "Calendar options. Optional; by default passes with a start time offer Add to calendar.",
      "type": "object",
      "additionalProperties": false,
      "minProperties": 1,
      "properties": {
        "add": { "type": "boolean" },
        "title": { "type": "string", "minLength": 1, "maxLength": 100 },
        "alertMinutesBefore": {
          "type": "array",
          "maxItems": 3,
          "uniqueItems": true,
          "items": { "type": "integer", "minimum": 0, "maximum": 10080 }
        }
      }
    },

    "source": {
      "description": "Where the data came from. Used for the back of the pass and, later, for email import.",
      "type": "object",
      "additionalProperties": false,
      "properties": {
        "kind": { "enum": ["email", "pdf", "screenshot", "webpage", "manual", "other"] },
        "sender": { "type": "string", "minLength": 1, "maxLength": 200 },
        "subject": { "type": "string", "minLength": 1, "maxLength": 200 },
        "receivedAt": { "$ref": "#/$defs/dateOrDateTime" }
      }
    },

    "warnings": {
      "description": "Short notes about anything uncertain. Shown to the user before they add the pass.",
      "type": "array",
      "maxItems": 20,
      "items": { "type": "string", "minLength": 1, "maxLength": 300 }
    },

    "dateTime": {
      "description": "ISO 8601 local date-time, ideally with a UTC offset: 2026-11-14T19:30:00+09:00. Without an offset, Passclip uses timeZone or asks the user.",
      "type": "string",
      "pattern": "^\\d{4}-\\d{2}-\\d{2}T\\d{2}:\\d{2}(:\\d{2}(\\.\\d{1,3})?)?(Z|[+-]\\d{2}:\\d{2})?$"
    },

    "dateOrDateTime": {
      "description": "A date (2026-12-31) or a date-time as in dateTime.",
      "type": "string",
      "pattern": "^\\d{4}-\\d{2}-\\d{2}(T\\d{2}:\\d{2}(:\\d{2}(\\.\\d{1,3})?)?(Z|[+-]\\d{2}:\\d{2})?)?$"
    },

    "hexColor": {
      "type": "string",
      "pattern": "^#[0-9A-Fa-f]{6}$"
    },

    "latitude": { "type": "number", "minimum": -90, "maximum": 90 },
    "longitude": { "type": "number", "minimum": -180, "maximum": 180 }
  }
}
